{
  "schema_version": "1.0.0-phase2a",
  "package_id": "synthetic-approved-research-package-20260722",
  "case": {
    "client": "SyntheticClient",
    "research_date": "2026-07-22",
    "input_land_numbers": "Synthetic縣Synthetic鄉Synthetic段001-002地號",
    "normalized_land_numbers": [
      "Synthetic縣Synthetic鄉Synthetic段001地號",
      "Synthetic縣Synthetic鄉Synthetic段002地號"
    ],
    "county": "Synthetic縣",
    "district": "Synthetic鄉",
    "land_section": "Synthetic段",
    "parcel_numbers": [
      "001",
      "002"
    ]
  },
  "fields": {
    "parcel_area_each": {
      "field": "parcel_area_each",
      "raw_value": {
        "001": 192.34,
        "002": 165.67
      },
      "normalized_value": {
        "001": 192.34,
        "002": 165.67
      },
      "unit": "sqm",
      "status": "official_confirmed",
      "source_type": "government",
      "source_name": "Synthetic縣政府地政資料",
      "source_url": "https://synthetic.example.gov.tw/land/001-002",
      "source_date": "2026-06-30",
      "retrieved_at": "2026-07-22T09:00:00+08:00",
      "evidence": "Synthetic縣政府公開地政資料確認了002的面積。",
      "confidence": 100,
      "conflicts": [],
      "manual_review_reason": ""
    },
    "parcel_area_total_sqm": {
      "field": "parcel_area_total_sqm",
      "raw_value": 358.01,
      "normalized_value": 358.01,
      "unit": "sqm",
      "status": "official_confirmed",
      "source_type": "government",
      "source_name": "Synthetic縣政府地政資料",
      "source_url": "https://synthetic.example.gov.tw/land/001-002",
      "source_date": "2026-06-30",
      "retrieved_at": "2026-07-22T09:00:00+08:00",
      "evidence": "逐筆面積加總為 358.01 平方公尺。",
      "confidence": 100,
      "conflicts": [],
      "manual_review_reason": ""
    },
    "parcel_area_total_ping": {
      "field": "parcel_area_total_ping",
      "raw_value": 108.28,
      "normalized_value": 108.28,
      "unit": "ping",
      "status": "official_confirmed",
      "source_type": "government",
      "source_name": "Synthetic縣政府地政資料",
      "source_url": "https://synthetic.example.gov.tw/land/001-002",
      "source_date": "2026-06-30",
      "retrieved_at": "2026-07-22T09:00:00+08:00",
      "evidence": "由官方面積換算為 108.28 坪。",
      "confidence": 100,
      "conflicts": [],
      "manual_review_reason": ""
    },
    "parcel_geometry": {
      "field": "parcel_geometry",
      "raw_value": {
        "type": "Polygon",
        "coordinates": [
          [
            [
              0,
              0
            ],
            [
              0,
              100
            ],
            [
              100,
              100
            ],
            [
              100,
              0
            ],
            [
              0,
              0
            ]
          ]
        ]
      },
      "normalized_value": {
        "type": "Polygon",
        "coordinates": [
          [
            [
              0,
              0
            ],
            [
              0,
              100
            ],
            [
              100,
              100
            ],
            [
              100,
              0
            ],
            [
              0,
              0
            ]
          ]
        ]
      },
      "unit": "wgs84",
      "status": "official_confirmed",
      "source_type": "government",
      "source_name": "Synthetic縣政府地政圖資",
      "source_url": "https://synthetic.example.gov.tw/geom/001-002",
      "source_date": "2026-06-30",
      "retrieved_at": "2026-07-22T09:00:00+08:00",
      "evidence": "地政系統提供可定位到本案地號的簡化幾何。",
      "confidence": 100,
      "conflicts": [],
      "manual_review_reason": ""
    },
    "parcel_count": {
      "field": "parcel_count",
      "raw_value": 2,
      "normalized_value": 2,
      "unit": "parcel",
      "status": "corroborated",
      "source_type": "user_provided",
      "source_name": "案件輸入",
      "source_url": "https://synthetic.example/internal/case",
      "source_date": "2026-07-22",
      "retrieved_at": "2026-07-22T09:00:00+08:00",
      "evidence": "輸入為 001、002 兩筆，與公開地號清單一致。",
      "confidence": 100,
      "conflicts": [],
      "manual_review_reason": ""
    },
    "land_category": {
      "field": "land_category",
      "raw_value": "丁種建築用地",
      "normalized_value": "丁種建築用地",
      "unit": "",
      "status": "official_confirmed",
      "source_type": "government",
      "source_name": "Synthetic縣政府地政資料",
      "source_url": "https://synthetic.example.gov.tw/land/001-002",
      "source_date": "2026-06-30",
      "retrieved_at": "2026-07-22T09:00:00+08:00",
      "evidence": "登記地目為丁種建築用地。",
      "confidence": 100,
      "conflicts": [],
      "manual_review_reason": ""
    },
    "current_land_use": {
      "field": "current_land_use",
      "raw_value": "空地",
      "normalized_value": "空地",
      "unit": "",
      "status": "official_confirmed",
      "source_type": "government",
      "source_name": "Synthetic縣政府地政資料",
      "source_url": "https://synthetic.example.gov.tw/land/001-002",
      "source_date": "2026-06-30",
      "retrieved_at": "2026-07-22T09:00:00+08:00",
      "evidence": "現況為空地，已由官方登記確認。",
      "confidence": 100,
      "conflicts": [],
      "manual_review_reason": ""
    },
    "zoning": {
      "field": "zoning",
      "raw_value": "住丁特",
      "normalized_value": "住丁特",
      "unit": "",
      "status": "official_confirmed",
      "source_type": "government",
      "source_name": "Synthetic縣政府都市計畫",
      "source_url": "https://synthetic.example.gov.tw/zoning/001-002",
      "source_date": "2026-05-15",
      "retrieved_at": "2026-07-22T09:00:00+08:00",
      "evidence": "官方分區證明顯示本案為住丁特。",
      "confidence": 100,
      "conflicts": [],
      "manual_review_reason": ""
    },
    "building_coverage_ratio": {
      "field": "building_coverage_ratio",
      "raw_value": "60%",
      "normalized_value": "60%",
      "unit": "percent",
      "status": "official_confirmed",
      "source_type": "government",
      "source_name": "Synthetic縣政府都市計畫",
      "source_url": "https://synthetic.example.gov.tw/zoning/001-002",
      "source_date": "2026-05-15",
      "retrieved_at": "2026-07-22T09:00:00+08:00",
      "evidence": "都市計畫書圖明定建蔽率 60%。",
      "confidence": 100,
      "conflicts": [],
      "manual_review_reason": ""
    },
    "floor_area_ratio": {
      "field": "floor_area_ratio",
      "raw_value": "180%",
      "normalized_value": "180%",
      "unit": "percent",
      "status": "official_confirmed",
      "source_type": "government",
      "source_name": "Synthetic縣政府都市計畫",
      "source_url": "https://synthetic.example.gov.tw/zoning/001-002",
      "source_date": "2026-05-15",
      "retrieved_at": "2026-07-22T09:00:00+08:00",
      "evidence": "都市計畫書圖明定容積率 180%。",
      "confidence": 100,
      "conflicts": [],
      "manual_review_reason": ""
    },
    "urban_plan_name": {
      "field": "urban_plan_name",
      "raw_value": "Synthetic都市計畫",
      "normalized_value": "Synthetic都市計畫",
      "unit": "",
      "status": "corroborated",
      "source_type": "government",
      "source_name": "Synthetic縣政府公開計畫",
      "source_url": "https://synthetic.example.gov.tw/plan",
      "source_date": "2025-12-01",
      "retrieved_at": "2026-07-22T09:00:00+08:00",
      "evidence": "官方網站與書圖均提及本案隸屬 Synthetic 都市計畫。",
      "confidence": 90,
      "conflicts": [],
      "manual_review_reason": ""
    },
    "zoning_control_reference": {
      "field": "zoning_control_reference",
      "raw_value": "住丁特建蔽率60%、容積率180%",
      "normalized_value": "住丁特建蔽率60%、容積率180%",
      "unit": "",
      "status": "official_confirmed",
      "source_type": "government",
      "source_name": "Synthetic縣政府都市計畫",
      "source_url": "https://synthetic.example.gov.tw/zoning/001-002",
      "source_date": "2026-05-15",
      "retrieved_at": "2026-07-22T09:00:00+08:00",
      "evidence": "書圖中管制要點明確記載住丁特強度。",
      "confidence": 100,
      "conflicts": [],
      "manual_review_reason": ""
    },
    "legal_source": {
      "field": "legal_source",
      "raw_value": "Synthetic縣政府公開都市計畫書圖",
      "normalized_value": "Synthetic縣政府公開都市計畫書圖",
      "unit": "",
      "status": "official_confirmed",
      "source_type": "government",
      "source_name": "Synthetic縣政府都市計畫",
      "source_url": "https://synthetic.example.gov.tw/zoning/001-002",
      "source_date": "2026-05-15",
      "retrieved_at": "2026-07-22T09:00:00+08:00",
      "evidence": "以官方書圖作為分區與強度結論之法令依據。",
      "confidence": 100,
      "conflicts": [],
      "manual_review_reason": ""
    },
    "special_control_rules": {
      "field": "special_control_rules",
      "raw_value": "無額外增額容積或退縮條件",
      "normalized_value": "無額外增額容積或退縮條件",
      "unit": "",
      "status": "corroborated",
      "source_type": "government",
      "source_name": "Synthetic縣政府都市計畫",
      "source_url": "https://synthetic.example.gov.tw/zoning/001-002",
      "source_date": "2026-05-15",
      "retrieved_at": "2026-07-22T09:00:00+08:00",
      "evidence": "已查核計畫書圖，未發現本案適用之特殊管制。",
      "confidence": 90,
      "conflicts": [],
      "manual_review_reason": ""
    }
  },
  "boundaries": {
    "north": {
      "boundary_type": {
        "field": "north_boundary_type",
        "raw_value": "road",
        "normalized_value": "road",
        "unit": "",
        "status": "corroborated",
        "source_type": "first_party",
        "source_name": "Synthetic地籍套繪",
        "source_url": "https://synthetic.example/internal/plot/001-002",
        "source_date": "2026-07-21",
        "retrieved_at": "2026-07-22T09:00:00+08:00",
        "evidence": "north向臨路，套繪結果一致。",
        "confidence": 90,
        "conflicts": [],
        "manual_review_reason": ""
      },
      "road_name": {
        "field": "north_road_name",
        "raw_value": "SyntheticNorth路",
        "normalized_value": "SyntheticNorth路",
        "unit": "",
        "status": "official_confirmed",
        "source_type": "government",
        "source_name": "Synthetic縣政府道路資料",